{
  "schema_name": "job_runtime_state_schema",
  "schema_version": "1.0.0",
  "job_id": "mkt_tenant-marketing-sim-repair_1773000036026",
  "job_type": "unknown",
  "tenant_id": "tenant-marketing-sim-repair",
  "state": "waiting_repair",
  "status": "error",
  "attempt": 1,
  "max_attempts": 3,
  "inputs": {
    "request": {
      "campaign_brief": "repair case"
    },
    "requested_job_type": "marketing_research"
  },
  "outputs": {
    "current_stage": "research",
    "stage_status": {
      "research": "queued",
      "strategy": "completed",
      "production": "queued",
      "publish": "paused"
    },
    "structured_status_updates": [
      {
        "at": "2026-03-08T20:00:36.030Z",
        "state": "queued",
        "status": "pending",
        "step": "research",
        "details": {
          "source": "backend_fallback"
        }
      },
      {
        "at": "2026-03-08T20:00:36.031Z",
        "state": "retrying",
        "status": "running",
        "step": "repair",
        "details": {
          "stage": "strategy",
          "attempt": 1
        }
      }
    ],
    "repair": {
      "repaired": true,
      "stage": "strategy",
      "attempts": 1,
      "max_attempts": 3,
      "repairs": [
        {
          "attempt": 1,
          "stage": "strategy",
          "patched_section": "outputs.stage_status.strategy",
          "rerun_scope": "strategy",
          "result": "pass"
        }
      ]
    }
  },
  "history": [
    {
      "at": "2026-03-08T20:00:36.030Z",
      "state": "queued",
      "status": "pending",
      "note": "marketing job accepted via backend fallback"
    },
    {
      "at": "2026-03-08T20:00:36.031Z",
      "state": "retrying",
      "status": "running",
      "note": "bounded repair applied to strategy attempt 1"
    }
  ],
  "created_at": "2026-03-08T20:00:36.030Z",
  "updated_at": "2026-03-08T20:00:36.031Z"
}
